{
  "protocol_version": "2.0",
  "request_id": "e46a9272-45e6-512a-925b-cc2d9dbb9157",
  "operation": "read",
  "scope_id": "22222222-2222-4222-8222-222222222222",
  "producer_instance_id": "33333333-3333-4333-8333-333333333333",
  "actor": {
    "type": "ephy",
    "id": "runtime-fixture"
  },
  "policy_id": "66666666-6666-4666-8666-666666666666",
  "policy_revision": 1,
  "consent_epoch": 1,
  "scope_generation": 1,
  "created_at": "2026-09-12T00:00:00Z",
  "auth": {
    "key_id": "fixture-key",
    "mac": "e6ba333c3d4ed3d92d220a31ec44f05a9cffe8c8386f999bbd425b73e5ffe3ef"
  },
  "query": null,
  "target": {
    "doc_id": "5996543a-0f50-51b9-8af7-58ec757d7a6f",
    "revision": 1,
    "sha256": "33d8a0d76e4b9b1b27596e5fa95c1c7892cf3b74b5433b8178f8daad281ef85c"
  }
}
